{
  "changes": [],
  "digest": "8ded7f43882583bcb3bd6083b348bc6a0152a6b7ece9c0093198f9ae6e0411b7",
  "files": {
    "kernel/1/kernel.json": {
      "digest": "de018bd90c025376181455493b0db0c075756b985579a1acbf0dc2de15971496",
      "version": "1.0.0"
    },
    "modules/lists/1/lists.json": {
      "digest": "8fbafa790f76568b548baee503b1e85d08c3f5bd2147c788d6e06570c5544cd9",
      "version": "1.0.0"
    }
  },
  "format": 1,
  "input": {
    "blob": "aca75af65c4261239d907bfd73705555874c85b1",
    "commit": "26c59ba1b235cd8d938c9877409e506f1b8d3f0c",
    "ir_sha256": "87b067af5a6f681ca31896fc0901bf717212e44d429f9c91da4095e17afb277c"
  },
  "lock": "main",
  "model": "6de7564e83beca5a55e040506d10456b3cb02bed821abca4a9d097b534a0a7e7",
  "previous": null,
  "release": "1.0.0",
  "rules": "9031a34033018bd27ca734c2aa1fe967bf1399888d7f6cc7b9a780ef23985e96"
}
