{
  "changes": [],
  "digest": "ad5cc9f3e2c088d781f33ab7f55f59f10514b442d34653d23a744464c357f24e",
  "files": {
    "documents/1/buyer-seat.json": {
      "digest": "cf6495703b423a94732e13707963fc08a938c4a13bc394e357a250e879f24868",
      "version": "1.0.0"
    },
    "documents/1/deal.json": {
      "digest": "74cbbb57b2aaa18e0f6fb329ec5bd821345a814a0fb74645e03fa08ecd24935d",
      "version": "1.0.0"
    },
    "kernel/1/kernel.json": {
      "digest": "727536d54448b7df043efc7896f31bae50cc2b880cbcba1dbf7b7ed670acf146",
      "version": "1.0.0"
    },
    "modules/buyer-seat/1/buyer-seat.json": {
      "digest": "a2735e29f70c000075b775b1f2932d07db2dd5f58d3535ee690d3a28931f63d9",
      "version": "1.0.0"
    },
    "modules/deal/1/deal.json": {
      "digest": "61118559ff5292fad416ce1365d601949d38d59003f19be33b2820dbbc23bbf4",
      "version": "1.0.0"
    }
  },
  "format": 1,
  "imports": {
    "https://adtechspec.noetis.dev/adcom/schemas/modules/lists/1/lists.json": "8fbafa790f76568b548baee503b1e85d08c3f5bd2147c788d6e06570c5544cd9"
  },
  "input": {
    "blob": "c2dc7944d257036aa6dbbe70ca084c4f6670da8e",
    "commit": "3028ddcb8d5faea44bdab272aeaa9be6b5980f81",
    "ir_sha256": "cc49f43b22fae88b0fb9dcd25134ae0f271e8ee749e75a8a744d95f6ba1f0423"
  },
  "lock": "main",
  "model": "9a10acdab635dc4781df8ffa6a77a56e56d06f6399e78cc5cfad0e059b8f2732",
  "previous": null,
  "release": "1.0.0",
  "rules": "362b295ca764331a2b7daf226fa17afb90ea19dcee8b6ae00fb9d99e8c6d7285"
}
