{
  "changes": [],
  "digest": "9ae9b64691aeca707551863d15beb7e0028593b8c475e0af55fe452cd027adbb",
  "files": {
    "kernel/1/kernel.json": {
      "digest": "addbe614d537a2a68b0c617c65d78393dd3b31c603aff8fbab09ab5415091d0e",
      "version": "1.0.0"
    },
    "modules/lists/1/lists.json": {
      "digest": "39a5f88c82c1fe6875c19ed6b4b7dbb54e750b2dcb1218b5bb41f8ecb749ceed",
      "version": "1.0.0"
    }
  },
  "format": 1,
  "input": {
    "blob": "ec21cf8425559495261d2b9c4084ddd3d26c4802",
    "commit": "d67a6a8dedc883e0655e239d97116a91df6052ed",
    "ir_sha256": "1a0d528740da412cc8c988496d26aa73d8e9d55b81dcaba8b224c8612c97533f"
  },
  "lock": "tag-202607",
  "model": "54645bf60e6e4405e46fc846b0acf1ad44e8be575c55a0e5f3a972b0bc63e82d",
  "previous": null,
  "release": "1.0.0",
  "rules": "eda359eaf7b5c1e255d87cedc564f64f00d10f3d3fce4ed282b639291aeb1b53"
}
