{
  "changes": [],
  "digest": "979355a8221711912235b953b7dc2f15a68d85233b87473bc7471a7cbab33161",
  "files": {
    "documents/1/buyer-seat.json": {
      "digest": "b0fe06c434175088c51ff1a668312af2cdb6dc17120a18f7f6cd79c98df386c9",
      "version": "1.0.0"
    },
    "documents/1/deal.json": {
      "digest": "a5a24fdf337b210ad70325a9e42c2920cdc80bb261e1edda0f5695921954dc38",
      "version": "1.0.0"
    },
    "kernel/1/kernel.json": {
      "digest": "7a3b29bbbcc683b3856bd6ce20931e5d8a282cc224c2b70fb03ed74be42c221b",
      "version": "1.0.0"
    },
    "modules/buyer-seat/1/buyer-seat.json": {
      "digest": "754efa9213874138538e8e296e3c8156d0844ea7d586a34a2a8ee2b30bf76dfd",
      "version": "1.0.0"
    },
    "modules/deal/1/deal.json": {
      "digest": "fd4b03ffd140c704c473ec9a2e9e701bdcee9832b93d7ab9a07a32281a0c75c6",
      "version": "1.0.0"
    }
  },
  "format": 1,
  "imports": {
    "https://adtechspec.noetis.dev/adcom/schemas/modules/lists/1/lists.json": "8fbafa790f76568b548baee503b1e85d08c3f5bd2147c788d6e06570c5544cd9"
  },
  "input": {
    "blob": "f675232c0e0d57b77ce1fc34b74baa2e42bc700a",
    "commit": "938a5d1fdb5705ae53b2584c90b9eb325b71a96b",
    "ir_sha256": "0004948ea36a5aea758bfc7f9d18e01f0e9290b6e185c4422e14fc62dcef7d79"
  },
  "lock": "tag-1.0-202602",
  "model": "2f3fe28334463022b67b980d923d8c8584a76e0a311f399a8633d2dac53b9762",
  "previous": null,
  "release": "1.0.0",
  "rules": "b3c4ae45fc91cb755827af8cd1228134e651414a1d3a722fec39149b73dce8f5"
}
